,question,answer,query_duration,answer_present,average_precision
1660,where did the 60's scoop take place,Canada,17,1,0.8333333333333333
1661,where does 12 years a slave take place,Louisiana,37,1,0.5352564102564102
1662,who's the actress that plays captain phasma,"Gwendoline Manuela Mariett Josephine Christie Brown ( born 28 October 1978 ) , known professionally as Gwendoline Christie",7,1,0.5
1663,who is the coach of ohio state football,Urban Meyer,12,1,0.7630782797449465
1664,when were the confederate states of america formed,February 1861,18,1,0.9166666666666666
1665,who sings i'm gonna hire a wino,David Frizzell,7,1,1.0
1666,who sang how do you talk to an angel,Jamie Walters,12,1,1.0
1667,when was the first olympic games held in ancient greece,776 BC,21,1,0.7100000000000001
1668,who wins sugar ray leonard or floyd mayweather,Leonard,10,1,0.8439685314685315
1669,who played in the original phantom of the opera,Michael Crawford,8,1,0.5942857142857143
1670,i ' m a big big girl in a big big world,Emilia Rydberg,10,1,1.0
1671,who plays alice in the vicar of dibley,Emma G.M. Chambers,6,1,0.2
1672,who sang black cars look better in the shade,Gino Vannelli,9,1,0.1
1673,who plays charles dickens in the man who invented christmas,Dan Stevens,9,1,1.0
1674,who sang oh i just can't wait to be king,Rowan Atkinson,10,1,0.5
1675,who sang oh i just can't wait to be king,Jason Weaver,10,1,0.5
1676,who sang oh i just can't wait to be king,Laura Williams,10,1,0.5
1677,who won australia's first olympic gold medal,Steven John Bradbury,16,0,0.0
1678,who killed the waynes in gotham tv series,Joe Chill,9,1,0.2547008547008547
1679,who plays jake in not another teenage movie,Chris Evans,10,1,1.0
1680,what's the percentage of canadian hockey players in the nhl,slightly less than 50 %,18,1,0.2
1681,how many american casualties in the battle of midway,307,18,1,1.0
1682,what type of garbage is thrown in green bins,unsorted municipal waste,8,1,1.0
1683,what type of garbage is thrown in green bins,biodegradable waste,8,1,0.7
1684,what type of garbage is thrown in green bins,compostable materials,8,1,1.0
1685,where was the beach scene in goonies filmed,"Goat Rock State Beach in Sonoma County , California",7,1,1.0
1686,when did the air force ones come out,1982,12,1,0.21581196581196577
1687,the limbic system is an important part of the brain because it regulates,the autonomic nervous system,11,1,0.5757575757575757
1688,the limbic system is an important part of the brain because it regulates,the endocrine system,24,1,0.6
1689,who plays chuck on the tv show chuck,Zachary Levi,31,1,0.6111111111111112
1690,what is the name of the ship in hitchhiker's guide,Heart of Gold,9,1,0.3535897435897436
1691,who was the first british pilot to break the sound barrier,John Derry,44,1,1.0
1692,where did the annual wife carrying world championships take place,"Sonkajärvi , Finland",30,1,1.0
1693,the intersection of the two sides of an angle is called the angles,vertex,31,1,0.976190476190476
1694,the board of directors of a u.s. corporation is elected by,the shareholders,33,1,0.706060606060606
1695,what is the name of the good the bad and the ugly theme song,"`` The Good , the Bad and the Ugly ''",21,1,1.0
1696,name of guinea pig in secret life of pets,Norman,18,1,0.5
1697,who is the number 1 most listened to on spotify,Drake,32,1,1.0
1698,when did the vw beetle body style change,1997,10,1,0.6087301587301588
1699,what is the equivalent of the cdc in canada,The Public Health Agency of Canada,10,1,0.2
1700,where will the new year be celebrated first,"Kiritimati ( Christmas Island ) , part of Kiribati",45,1,0.16666666666666666
1701,where will the new year be celebrated first,Samoa,60,1,0.6666666666666666
1702,where will the new year be celebrated first,Tonga,60,1,0.16666666666666666
1703,who was the first person buried at arlington national cemetery,Private William Henry Christman of Pennsylvania,24,1,1.0
1704,who was in charge of the d day invasion,British Lieutenant - General Frederick E. Morgan,19,1,0.07692307692307693
1705,what time did the bomb go off in manchester,22 : 31 BST ( UTC + 01 : 00 ),34,1,1.0
1706,last time yankees made it to the playoffs,2017,23,1,0.6551543694400837
1707,when did the u.s. create a lottery system for immigration,1990,26,1,0.639092389092389
1708,who plays gwen on as the world turns,Jennifer Landon,9,1,0.1111111111111111
1709,who plays sam healy in orange is the new black,Michael John Harney,14,1,0.5
1710,what was the name of the iraq war,The Iraq War,12,1,0.8895833333333334
1711,how many levels are there on tapped out,939,9,1,1.0
1712,who plays bays grandma on switched at birth,Ivonne Coll,9,1,0.3333333333333333
1713,who was the president during cuban missle crisis,John F. Kennedy,9,1,0.4894230769230769
1714,who established an efficient system to train nurses,Florence Nightingale,18,1,0.8541666666666666
1715,what's the weather like in seoul korea,temperate climate with four distinct seasons,10,1,0.5
1716,what's the weather like in seoul korea,humid continental / subtropical climate with dry winter,7,1,0.5
1717,where is the genetic material of bacterium found,bacterial cells,8,1,0.6560606060606061
1718,who is the actress that plays crazy eyes on orange is the new black,Uzoamaka Nwanneka `` Uzo '' Aduba,21,1,0.16666666666666666
1719,what kind of wood does rudy's bbq use,oak,10,1,0.6111111111111112
1720,who has the highest sales tax in the nation,territory of Puerto Rico has a higher 10.5 % value added tax,14,1,0.3333333333333333
1721,when does the lion witch and the wardrobe take place,1940,10,1,0.6633333333333333
1722,who sang built this city on rock and roll,Starship,17,1,1.0
1723,when did the shah come to the us,22 October 1979,29,0,0.0
1724,what is the 16 days of activism campaign,international campaign to challenge violence against women and girls,34,1,1.0
1725,who did stephen jackson win a ring with,San Antonio Spurs,11,1,0.5409090909090909
1726,who chooses the vice president if there is no majority,the Senate,7,1,0.7109090909090909
1727,who sang the song give me some sunshine,Suraj Jagan,14,0,0.0
1728,what is the anatomical name for the elbow joint,synovial hinge joint,8,1,1.0
1729,what concept was the belief in devine right used to support,a political and religious doctrine of royal and political legitimacy,21,0,0.0
1730,when did dominican republic gain independence from haiti,"February 27 , 1844",12,1,0.85515873015873
1731,who sang i've never been loved like this before,Stephanie Mills,12,1,1.0
1732,damage to this part of the brain can result in reduced ability to comprehend and/or produce humor,right hemisphere,13,1,0.5580197580197579
1733,where was the famous i have a dream speech given,"from the steps of the Lincoln Memorial in Washington , D.C.",17,1,1.0
1734,where is the continental divide on i 70,The Eisenhower Tunnel,9,0,0.0
1735,what are the main areas of focus for quality management,"quality planning , quality assurance , quality control and quality improvement",18,1,1.0
1736,who sang lifes been good to me so far,Joe Walsh,12,1,1.0
1737,when did mr game and watch come out,1980,13,1,0.4708624708624709
1738,where does digestion of fat take place in human digestive system,the small intestine,11,1,0.849145299145299
1739,where does digestion of fat take place in human digestive system,the mouth,11,1,1.0
1740,when was berlin split into east and west,1945,13,1,0.9622222222222224
1741,where does the appalachian trail start in new york,Bear Mountain,20,1,1.0
1742,where was the treaty of paris 1783 signed,Paris,9,1,1.0
1743,who sang last night a dj saved my life,Rose Marie Ramsey,17,1,1.0
1744,who sang last night a dj saved my life,Réjane `` Reggie '' Magloire,17,1,1.0
1745,who won big brother battle back season 18,Victor,25,1,0.7370962370962371
1746,when did mcdonald's start selling happy meals,June 1979,11,1,1.0
1747,who made the song ride the white horse,the Danish duo Laid Back,10,1,1.0
1748,according to federalist 78 what part of the government is the weakest,Judiciary branch,10,1,1.0
1749,who did wilt chamberlain play for in the nba,Los Angeles,11,1,0.7540043290043289
1750,who did wilt chamberlain play for in the nba,Philadelphia / San Francisco Warriors,14,1,1.0
1751,who did wilt chamberlain play for in the nba,Philadelphia 76ers,17,1,0.5382575757575757
1752,when was the iphone 6 released in canada,July 2017,19,1,1.0
1753,who said mirror mirror on the wall who's the fairest of them all,the Evil Queen,15,1,1.0
1754,when did r kelly first album come out,1993,46,1,0.5444444444444444
1755,what is the length of the empire state building,"1,454 feet ( 443.2 m )",11,1,1.0
1756,how old do you have to be to enlist in the army in korea,18,29,1,0.9086435786435788
1757,what are the two types of organ donors,brain dead,25,1,0.8333333333333333
1758,what are the two types of organ donors,living,50,1,0.8259259259259257
1759,eaps were originally designed to help employees that had what type of problem,personal problems and / or work - related problems,18,1,1.0
1760,when is the opening ceremonies for the olympics 2018,began at 20 : 00 KST and finished at approximately 22 : 20 KST,9,1,1.0
1761,when is the opening ceremonies for the olympics 2018,on 9 February 2018,10,1,0.5213675213675213
1762,where does barney work in how i met your mother,Altrucell,16,0,0.0
1763,who has played the most games in the premier league,Gareth Barry,11,0,0.0
1764,where is the green bay packers stadium located,"Green Bay , Wisconsin",14,1,0.8120490620490619
1765,what drug did tony soprano take in vegas,peyote,11,1,0.19444444444444442
1766,what drug did tony soprano take in vegas,marijuana,11,1,0.16666666666666666
1767,who was the first president to get assasinated,Lincoln,22,1,0.07692307692307693
1768,players to average triple double in a season,Russell Westbrook,11,1,0.5909090909090909
1769,players to average triple double in a season,Oscar Robertson,11,1,0.5909090909090909
1770,when did the dont ask dont tell policy start,"February 28 , 1994 , when Department of Defense Directive 1304.26 issued on December 21 , 1993 , took effect",10,1,0.14285714285714285
1771,who sang i cant stand the rain first,Ann Peebles,28,1,0.6666666666666666
1772,who is the child actor in august rush,Alfred Thomas `` Freddie '' Highmore,12,0,0.0
1773,who does sanchez play for in the world cup,Chile,18,1,0.7269230769230768
1774,who sang the opening line of do they know it's christmas 1989,Kylie Minogue,24,1,1.0
1775,what is the first major sin in islam,the association of others with Allah or Shirk,19,1,1.0
1776,where is iron absorbed in the small intestine,the basolateral end of the intestine cells,8,1,0.25
1777,how many seasons of the vicar of dibley are there,two,6,1,0.8803646353646354
1778,what does the sun symbolize in the philippine flag,sovereignty,15,1,0.8409090909090909
1779,what does the sun symbolize in the philippine flag,unity,18,1,0.6706730769230769
1780,what does the sun symbolize in the philippine flag,freedom,13,1,0.5210317460317461
1781,what does the sun symbolize in the philippine flag,people 's democracy,11,1,1.0
1782,who sings the original king of the road,country singer Roger Miller,9,1,1.0
1783,when does the new show legacies come out,"October 25 , 2018",12,0,0.0
1784,where did dante live after he was exiled,"beneath the springs of Arno , near Tuscany",11,1,1.0
1785,how long has the show blue bloods been on tv,"September 24 , 2010",13,1,0.625
1786,who was the original singer of gentle on my mind,John Hartford,8,1,1.0
1787,the yellowstone supervolcano is an example of which kind of volcanism,hotspot,9,1,0.8928571428571428
1788,when did we drop the atomic bomb on hiroshima,"August 6 , 1945",9,1,0.5658119658119659
1789,in what way did the british implement control in west asia,Indirect rule,27,1,0.375
1790,when is next maze runner movie coming out,"January 26 , 2018",10,1,0.7333333333333333
1791,when did humans first occupy the international space station,November 2000,32,1,1.0
1792,who is the person who plays black panther,Chadwick Aaron Boseman,10,0,0.0
1793,who nominates a new supreme court justice to serve on the u.s. supreme court,the President of the United States,20,0,0.0
1794,who owns the new england patriots before robert kraft,James Orthwein,12,1,0.875
1795,what happened to jackie on that 70s show,"in the final episode , Fez and Jackie finally get together and kiss atop the water tower",11,1,0.1111111111111111
1796,who sings in tangled i see the light,Zachary Levi,10,1,0.8528571428571429
1797,who sings in tangled i see the light,Mandy Moore,10,1,0.8734126984126982
1798,the binding energy of a nucleus is the amount of energy needed to,disassemble the nucleus of an atom into its component parts,9,1,0.5
1799,who did colton play for in the nfl,San Diego Chargers,7,1,1.0
1800,when did construction commenced of st peter basilica,between 319 and 333 AD,11,1,0.5
1801,what is the origin of the word appalachian,"a Native American village near present - day Tallahassee , Florida",8,1,0.5
1802,friday the 13th where jason is not the killer,Friday the 13th : A New Beginning,11,1,0.5626373626373627
1803,who played the coach on friday night lights,Kyle Martin Chandler,13,0,0.0
1804,when does the movie battle of the sexes come out,"September 22 , 2017",16,1,0.5
1805,when does a tenant become a sitting tenant,A sitting tenant is a tenant already in occupation of premises,7,1,1.0
1806,how many episodes of gossip girl is there,121,17,1,0.3333333333333333
1807,what is the population of muslim in pakistan,About 97.0 %,10,1,1.0
1808,who played drums on josie by steely dan,Jim Keltner,7,1,0.75
1809,where do they live in boy meets world,the Philadelphia area,12,1,1.0
1810,a 2000 ruling by a federal court found that microsoft,monopolization,14,1,0.2
1811,when did the first rainbow vacuum come out,1955,24,1,0.5
1812,what is the aim of celebrating earth hour,"to turn off non-essential electric lights for one hour , from 8 : 30 to 9 : 30 p.m. on a specific day towards the end of March , as a symbol of commitment to the planet",13,1,1.0
1813,what does the location of a terminal moraine tell you about the glacier,the terminal extent of the ice,17,1,1.0
1814,who won the all ireland hurling final 2011,Kilkenny,11,1,0.9924242424242424
1815,when were the common core state standards developed,2009,13,1,0.6971088435374148
1816,what county is jersey city nj located in,U.S. state,13,1,0.8857142857142857
1817,who voices ellie in the last of us,Ashley Johnson,9,1,0.7780612244897959
1818,who does the voice for the crab on moana,Jemaine Clement,7,1,0.9166666666666666
1819,who play peter pan in once upon a time,Robert Andrew `` Robbie '' Kay,19,0,0.0
1820,who is the girl on fox and friends,Ainsley Earhardt,10,1,1.0
1821,what happens when ammonium nitrate reacts with water,endothermic,11,1,0.5313852813852814
1822,what are the eagles in lord of the rings,the guardians of animal life,15,1,0.14285714285714285
1823,what do you call a group of meerkats,"a `` mob '' , `` gang '' or `` clan ''",9,1,1.0
1824,when do babies start to have stranger anxiety,peaks from 6 to 12 months,13,1,1.0
1825,where did the 2017 super bowl take place,"NRG Stadium in Houston , Texas",22,1,0.19090909090909092
1826,who is considered founder of the gupta empire,Sri Gupta,10,1,1.0
1827,who is ferdinand blumentritt in life of rizal,"a teacher , secondary school principal in Leitmeritz , lecturer , and author of articles and books in the Philippines and its ethnography",10,1,1.0
1828,who sang the theme tune to the world is not enough,American - Scottish alternative rock group Garbage,9,1,0.5
1829,who played steve in wonder woman tv show,Lyle Waggoner,16,1,0.75
1830,what is the function of pharyngeal pouches in aquatic chordates,respiration of aquatic chordates,6,1,1.0
1831,what is the function of pharyngeal pouches in aquatic chordates,filter - feeding,6,1,0.6666666666666665
1832,who plays the twins on the show quantico,Yasmine Al Massri,16,1,0.8666666666666667
1833,when was 100 naira note introduced in nigeria,1999,11,1,0.8269230769230769
1834,who was the founder of the knights of columbus,Father Michael J. McGivney,8,1,1.0
1835,how many seasons are there in switched at birth,five,10,1,0.49358974358974356
1836,who is the original singer of all by myself,Eric Carmen,8,1,1.0
1837,how many packs of cigarettes come in a case,"A carton of cigarettes usually contains 10 packs , totaling 200 cigarettes . Some cartons contain twenty packs , totaling 400 cigarettes .",12,1,1.0
1838,who is the issuing authority for california drivers license,California Department of Motor Vehicles ( DMV ),14,1,0.25
1839,who wrote the song we shall behold him,Dottie Rambo,9,1,0.1
1840,who won america's next top model season 4,Naima Mora,15,1,0.8333333333333334
1841,who does the voice of jafar in aladdin,Jonathan Freeman,7,1,0.5832362082362081
1842,which two district of nepal border on both india and china,Mechi,30,1,0.8095238095238094
1843,which two district of nepal border on both india and china,Mahakali Zone,27,1,1.0
1844,who wrote close encounters of the third kind,Steven Spielberg,21,1,1.0
1845,when is the litany of the saints sung,at the Easter Vigil,19,1,0.7
1846,who sang walk like a man in the 80's,Divine,15,0,0.0
1847,who sang walk like a man in the 80's,Mary Jane Girls,16,0,0.0
1848,what happened to the amusement park in myrtle beach,closed,14,1,0.9510602823102823
1849,when did derek shepherd leave grey's anatomy,2015,27,1,0.8909090909090909
1850,when was the first episode of pretty little liars filmed,Vancouver,15,1,0.8333333333333333
1851,who owns the roosevelt hotel in new york,Pakistan International Airlines,32,1,1.0
1852,where will the superbowl be played this year,"at U.S. Bank Stadium in Minneapolis , Minnesota",22,0,0.0
1853,who built the dome of the rock mosque,initially completed in 691 CE at the order of Umayyad Caliph Abd al - Malik,13,1,1.0
1854,where do an organism’s genes come from,their parents,9,1,1.0
1855,the financial crisis of 2008 was caused by,a crisis in the subprime mortgage market,15,1,1.0
1856,the process by which a mechanical device is used to move a fluid or gas to transfer heat,forced convection,13,1,0.7916666666666666
1857,how have we not run out of ip addresses,"development and deployment of its successor protocol , IPv6",11,1,0.14285714285714285
1858,actor who played william beech in goodnight mr tom,Nick Robinson,13,1,1.0
1859,who won the first drama contest in 534,Thespis,17,1,0.4157142857142857
1860,who sings are you with me lost frequencies,Easton Corbin,10,1,1.0
1861,where did the last name ball originate from,English surname,14,0,0.0
1862,when did pokemon diamond and pearl come out,"September 28 , 2006",19,1,0.6666666666666666
1863,who is the writer of war and peace,Leo Tolstoy,7,1,0.5909090909090909
1864,what is the function of the tapetum lucidum in animals,superior night vision,7,1,0.7159090909090909
1865,who played seymour in last of the summer wine,Michael William ffolliott Aldridge,26,1,0.09090909090909091
1866,who was voted the leader of the second continental congress,John Hancock,18,1,0.8303571428571428
1867,who was voted the leader of the second continental congress,Peyton Randolph,18,1,1.0
1868,when did the new season of wentworth start,2019,9,1,0.16666666666666666
1869,winner of dancing with the stars last season,Peta Murgatroyd,14,1,0.633158904587476
1870,winner of dancing with the stars last season,Nyle DiMarco,13,1,0.17142857142857143
1871,when was the last time it snowed in miami florida,January 1977,13,1,1.0
1872,what is the base of the statue of liberty made of,"poured concrete walls , up to 20 feet ( 6.1 m ) thick , faced with granite blocks",20,1,1.0
1873,what were the hiwis in world war ii,auxiliary forces recruited from the indigenous Soviet populations in the areas acquired by Nazi Germany in Eastern Europe,23,1,1.0
1874,when does the next season of the dragon prince come out,2019,18,1,0.5769230769230769
1875,what were significant achievements of the ancient egyptian in science and technology,lever,20,1,0.4772727272727273
1876,what were significant achievements of the ancient egyptian in science and technology,the ramp,14,1,0.7575757575757575
1877,what were significant achievements of the ancient egyptian in science and technology,the lever,14,1,0.5909090909090909
1878,what were significant achievements of the ancient egyptian in science and technology,rope trusses,13,1,1.0
1879,how many oil rigs are off the coast of louisiana,"more than 4,000",11,1,0.25
1880,in india which businessman had pilot license number one,J.R.D. Tata,15,1,0.5
1881,what is the name of the strait between djibouti and yemen,Bab - el - Mandeb,9,1,0.9797979797979798
1882,when is the new han solo movie coming out,"May 25 , 2018",11,1,0.5
1883,where does the tongue attach to the mouth,frenulum,7,1,0.7986111111111112
1884,how many electrons fit in the 3rd energy level,18,24,1,0.51
1885,where is the university of california irvine located,"Irvine , California",9,1,0.6464646464646464
1886,who sang how far i'll go in the movie,American actress and singer Auliʻi Cravalho in her role as Moana,8,1,1.0
1887,how tall is the drop on california screamin,108 - foot ( 33 m ),16,1,1.0
1888,who is the father of bree's baby,Austin,12,0,0.0
1889,frozen who sings let it go in the movie,Queen Elsa,19,1,0.6333333333333333
1890,who is the narrator in to kill a mocking bird,six - year - old Jean Louise Finch,9,1,0.2
1891,who plays james rhodes in iron man 2,Don Cheadle,13,1,0.7291666666666666
1892,what was the name of australia's first prime minister,Sir Edmund `` Toby '' Barton,32,0,0.0
1893,who did aston villa beat in the european cup final,West German league winners Bayern Munich,26,1,0.3333333333333333
1894,who is associated with agrarian unrest of 1907 in the punjab,Ajit Singh,17,1,1.0
1895,who is associated with agrarian unrest of 1907 in the punjab,Lala Lajpat Rai,9,1,0.6666666666666666
1896,who plays tywin lannister in game of thrones,Dance,12,1,0.6434213934213935
1897,who was the speaker of lok sabha before he become the president of india,Neelam Sanjiva Reddy,30,0,0.0
1898,who does eloise end up with in table 19,Teddy,28,1,1.0
1899,where was the movie breakfast at tiffany's filmed,Paramount Studios lot in Hollywood,9,1,1.0
1900,where was the movie breakfast at tiffany's filmed,New York City,35,1,0.5909090909090909
1901,who plays admiral cornwell on star trek discovery,Jayne Brook ( born Jane Anderson,24,1,0.14285714285714285
1902,who wrote the song you don't bring me flowers anymore,Marilyn Bergman,14,1,1.0
1903,who wrote the song you don't bring me flowers anymore,Neil Diamond,21,1,0.7575757575757575
1904,who wrote the song you don't bring me flowers anymore,Alan Bergman,12,1,1.0
1905,the fact that the three branches can only do what is in the constitution is an example of,Constitutional law,45,1,0.41666666666666663
1906,where is the women's final four being held this year,"Nationwide Arena in Columbus , Ohio",67,0,0.0
1907,who sang ive been waiting for a girl like you,Foreigner,32,1,1.0
1908,what were the years of us involvement in the vietnam war,1955 to 1975,39,1,0.5769230769230769
1909,who played reverend mother in sound of music,Mary Margaret `` Peggy '' Wood,9,0,0.0
1910,journal of the kansas entomological society impact factor,0.607,10,1,1.0
1911,when did the military stop putting cigarettes in rations,1975,11,1,0.6458333333333333
1912,what happened to the girl's mom on full house,dies in a car accident caused by a drunk driver,8,0,0.0
1913,who did the nz company buy land off before selling it to settlers,Māori,18,1,1.0
1914,who is the host of lottery dream home,David Reed Bromstad,10,1,0.1111111111111111
1915,is guyana part of the caribbean or south america,South America,24,1,1.0
1916,who brought the civil war to an end in april 1865,President Johnson,13,1,0.26666666666666666
1917,where does the saying the road to hell is paved with good intentions come from,Saint Bernard of Clairvaux,17,1,1.0
1918,who has sung most number of songs in india,Asha Bhosle,33,1,1.0
1919,who sang lead vocals on 25 or 6 to 4,Jason Scheff,16,1,0.5833333333333334
1920,where does the us rank in corn production,largest producer of corn in the world,31,1,1.0
1921,who is the current attorney general of illinois,Lisa Madigan,10,1,0.8928571428571428
1922,a famous feature of the national theatre's olivier stage is its,drum revolve,18,1,1.0
1923,the office episode where andy punches a wall,`` The Return '',27,1,0.3333333333333333
1924,what is the radius of the hydrogen atom,5.291 772 1067 ( 12 ) × 10 m,11,1,0.3333333333333333
1925,who owns the senkaku/diaoyu dao islands,Japan,26,1,0.9022333222333224
1926,channel that separates isle of wight from mainland,the English Channel,10,1,0.5925925925925926
1927,which color is among the most common for diamonds,a range of pale yellow or brown color,12,1,1.0
1928,when does the new season of hard knocks start,"August 7 , 2018",16,1,1.0
1929,who played guitar on lou reed rock and roll animal,Stephen John Hunter,11,1,0.3333333333333333
1930,who is the main character in no game no life,Sora,8,1,1.0
1931,who became president in 1929 the year of the great crash,Herbert Clark Hoover,19,0,0.0
1932,where did the invasion of italy take place,around Salerno,16,1,1.0
1933,when did table tennis become an olympic sport,1988,9,1,0.868470695970696
1934,what is the g20 meeting and where did it occur this past summer,"Hamburg Messe , in the city of Hamburg , Germany",33,1,0.5
1935,what is the g20 meeting and where did it occur this past summer,meeting of the Group of Twenty,23,1,0.5
1936,what is full form of ctc in salary,Cost to company,10,1,1.0
1937,what does the yin and yang symbol stand for,"how seemingly opposite or contrary forces may actually be complementary , interconnected , and interdependent in the natural world , and how they may give rise to each other as they interrelate to one another",10,1,1.0
1938,where did the phrase slim pickens come from,Louis Burton Lindley Jr .,10,1,1.0
