,question,answer,query_duration,answer_present,average_precision
3620,member of ireland society founded in 1795 to uphold protestant religion,the Orange Order,15,1,0.30555555555555547
3621,who came up with the resource based view,Jay Barney,16,1,1.0
3622,who was the first canadian in space what does he do now,Joseph Jean - Pierre Marc Garneau,37,0,0.0
3623,when does the new season of el chapo come out on netflix,"July 27 , 2018",44,1,1.0
3624,who owns ringling brothers and barnum & bailey circus,Feld Entertainment,10,1,0.6666666666666666
3625,when was the first plane used in ww1,1914,26,0,0.0
3626,when is the premiere of the flash season 5,"October 9 , 2018",13,1,1.0
3627,the meaning of the rosary in the roman catholic church,a form of prayer,13,1,1.0
3628,when did the range rover evoque come out,July 2011,9,1,1.0
3629,number of vehicles registered in the united states,263.6 million,31,1,1.0
3630,who sings darling if you want me to be closer,Seals and Crofts,10,0,0.0
3631,when did fullmetal alchemist brotherhood anime come out,"April 10 , 2009",9,1,1.0
3632,. in gothic architecture the main purpose of the flying buttress was to,convey to the ground the lateral forces that push a wall outwards,12,1,1.0
3633,the ashoka pillar at allahabad provides information about the reign of,"Gupta emperor , Samudragupta",20,1,1.0
3634,geared turbofan jet engine from pratt & whitney,Pratt & Whitney PW1000G,18,1,0.6428571428571428
3635,who is the issuing authority for canadian passports,"Passport Program of Immigration , Refugees and Citizenship Canada",28,1,1.0
3636,who is second in line to become president,Speaker of the House of Representatives,28,0,0.0
3637,what does the len function do in python,to denote the length of a string,15,1,1.0
3638,when did the first sex and the city movie come out,2008,38,1,0.8528571428571429
3639,who played ted mosby in how i met your mother,Joshua Radnor,11,0,0.0
3640,where does the perks of a wallflower take place,Pittsburgh suburb,8,1,1.0
3641,what year did they put black boxes in cars,1993,27,1,0.1625
3642,what animal is master shifu in kung fu panda movie,red panda,10,1,0.7
3643,who won season 4 of the great british baking show,Frances Quinn,25,1,1.0
3644,where is the pectoral muscle located in the human body,under the breast,7,1,1.0
3645,what does the word meter mean in poetry,the basic rhythmic structure of a verse or lines in verse,24,1,0.14285714285714285
3646,who does tess end up with on mcleods daughters,Nick,10,1,0.95
3647,what actor played ben stone on law and order,Michael Moriarty,13,1,0.942857142857143
3648,where are the villages located in central florida,approximately 45 miles northwest of Orlando and 75 miles northeast of Tampa,17,1,1.0
3649,who created a statue of the idealized male thus creating the greek canon of proportions,Polykleitos,22,1,0.7611111111111111
3650,who is featured on beibs in the trap,Nav,8,1,0.4833333333333333
3651,when did they stop putting cigarettes in mres,1975,9,1,1.0
3652,when was batman first called the dark knight,Batman # 1 ( Spring 1940 ),22,1,0.25
3653,where is the crown of your head located,the whole head,20,0,0.0
3654,where is the crown of your head located,the top of the head,11,0,0.0
3655,largest underground chambers in the world at gunung mulu is,Sarawak Chamber,9,1,1.0
3656,where is the national championship football game being played this year,"Mercedes - Benz Stadium in Atlanta , Georgia",32,0,0.0
3657,where did colton from the bachelorette play college football,Illinois State,20,1,1.0
3658,the number of elements in the fourth period is,18,16,1,0.8160037878787879
3659,why did the soviets not like the marshall plan,by making beneficiary countries economically dependent on the United States .,20,1,0.5
3660,why did the soviets not like the marshall plan,their belief that the Plan was an attempt to weaken Soviet interest in their satellite states,18,1,0.5
3661,where does simply orange get their oranges from,Florida,21,1,0.5714285714285714
3662,who does luce end up with in fallen,Daniel,10,1,0.81
3663,who owns the water in big bear lake,Big Bear Municipal Water District,10,1,1.0
3664,where does ohio state play their football games,Ohio Stadium,16,1,0.9342069546615
3665,who was the woman in video killed the radio star,Virginia Hey,23,1,1.0
3666,what is the climate like in san francisco,a warm - summer Mediterranean climate,28,1,1.0
3667,who is the speaker in she dwelt among the untrodden ways,the poet,9,1,1.0
3668,origin of the names of the week in english,Hellenistic astrology,27,1,1.0
3669,who sang will it go round in circles,Billy Preston,19,1,1.0
3670,played ada ron carver on law and order,Courtney B. Vance,17,1,1.0
3671,when did the social security act become law,1935,22,1,0.6323438466295609
3672,who directed the movie once upon a time in the west,Sergio Leone,11,1,0.8928571428571428
3673,who started career as diamond sorter in mumbai,Adani,10,1,1.0
3674,where did the last name ratliff come from,British origin,11,1,1.0
3675,youngest person to reach the top of mount everest,Jordan Romero,9,1,0.12692307692307692
3676,when did justin biebers song baby come out,"January 18 , 2010",11,1,1.0
3677,when did the last civil war veteran pass away,"August 2 , 1956",14,0,0.0
3678,where do the names of the elements come from,"are sometimes named after people , especially the synthetic elements discovered ( created ) after ca . 1940",11,1,1.0
3679,who serves as head of their political party,a party leader,8,1,1.0
3680,what is the name of the senate president in nigeria,Bukola Saraki .,9,1,1.0
3681,who's played in the nba the longest,Kevin Garnett,7,1,0.30480186480186483
3682,who's played in the nba the longest,Robert Parish,7,1,0.3333333333333333
3683,who's played in the nba the longest,Kevin Willis,7,0,0.0
3684,who was the bond girl in you only live twice,Kissy Suzuki,12,1,0.8095238095238094
3685,who plays julia roberts daughter in the movie mother's day,Britt Robertson,10,1,0.2
3686,three athletic events that use the si system of measurement,Olympic trials,32,0,0.0
3687,three athletic events that use the si system of measurement,"World University Games in Moscow , Russia",22,0,0.0
3688,three athletic events that use the si system of measurement,U.S. NCAA,27,0,0.0
3689,when did the beatles come to the us,February 1964,16,1,0.4206349206349206
3690,who appoints the chief minister of a state,The Governor,7,1,0.842947607947608
3691,when the letters of a word stand for something,acronym,16,0,0.0
3692,what is the normal resolution for a computer,1366 × 768,8,1,0.6666666666666666
3693,summary of the poem in the bazaars of hyderabad written by sarojini naidu,the social and the cultural life of Hyderabad,16,1,1.0
3694,who is in england's group in the world cup,Tunisia,27,1,0.225
3695,who is in england's group in the world cup,Belgium,24,1,0.42329004329004327
3696,who is in england's group in the world cup,Panama,36,1,0.3416666666666666
3697,where is de beers located in south africa,Kimberley,27,1,0.6994047619047619
3698,when did ellen come back to life in supernatural,sixth season episode `` My Heart Will Go On '',17,1,0.625
3699,who was named as a sports person of the year 2018,Roger Federer,33,1,0.125
3700,when is season 15 of grey's anatomy coming on,"September 27 , 2018",25,1,1.0
3701,where is white matter located in the brain,the Corpus callosum,10,1,0.5682539682539682
3702,who compiled and published the first assames dictionary in 1867,Hemchandra Barua,27,1,0.7
3703,what was the name of the virus in contagion,Meningoencephalitis Virus One ( MEV - 1 ),7,1,1.0
3704,who sings the opening song in the last boy scout,Bill Medley,11,1,1.0
3705,which festival in india is also known as festival of flowers,Bathukamma,11,0,0.0
3706,who declared christianity the official religion of rome,Emperor Theodosius I,15,1,0.30965034965034965
3707,when was the first census taken in india,1881,27,1,0.7302564102564103
3708,when did child tax credit start in uk,1910,18,1,0.16666666666666666
3709,when did kiev become the capital of ukraine,1991,33,1,1.0
3710,longest road between two towns in south africa,N2,32,1,1.0
3711,when was the last time newcastle won the fa cup,1955,12,1,0.8333333333333333
3712,who holds the world record for the women's marathon,"Paula Jane Radcliffe , MBE",9,0,0.0
3713,when did the lead singer of ac/dc die,19 February 1980,9,1,0.5159090909090909
3714,who wrote don t let the sun go down on me,Elton John,23,1,1.0
3715,who won season 13 of hell's kitchen,La Tasha McCutchen,30,1,1.0
3716,where does the colorado river in texas start from,"south of Lubbock , on the Llano Estacado , near Lamesa",22,1,1.0
3717,how many horse hairs are on a violin bow,between 150 and 200 hairs,16,1,1.0
3718,a statement or report that records the fluctuation in business's capital is referred as,statement of change in financial position,11,1,0.08333333333333333
3719,what freeway runs through seattle portland sacramento and los angeles,Interstate 5,28,1,0.7709145021645021
3720,name the italian who reinterpreted the message of bible,"Domenico Scandella ( 1532 -- 1599 ) , also known as Menocchio",23,0,0.0
3721,what is another name for plants in the food web,Basal species,11,1,1.0
3722,what is the meaning of lax is in los angeles airport,no specific meaning,17,1,1.0
3723,who won the mvp in the super bowl this year,Philadelphia Eagles quarterback Nick Foles,20,1,0.3333333333333333
3724,how old did the oldest human live to,"122 years , 164 days",12,1,1.0
3725,when was the last time houston astros were in the world series,2017,26,1,0.9121572871572871
3726,which german state benefited most from the territorial changes made by the congress of vienna,German Kingdoms of Hanover,23,1,1.0
3727,when was the first lettered machine - like typewriter invented and by whom,Pellegrino Turri had made one in Italy in 1808,41,1,0.5
3728,the bilingual education act of 1968 was passed to ensure,the needs of limited English speaking ability ( LESA ) students,20,1,1.0
3729,how many letters does the greek alphabet have,24,23,1,0.8666666666666667
3730,who sings if you see her with reba,Brooks & Dunn,12,1,1.0
3731,when were july and august added to the calendar,8 BC,37,1,0.3131313131313131
3732,when were july and august added to the calendar,44 BC,33,1,0.3333333333333333
3733,waste material that passes from baby to mother,Meconium,10,0,0.0
3734,when was the last burning at the stake in england,1789,16,1,1.0
3735,how many books did paul write in the bible,13,14,1,0.5342712842712842
3736,what in greek orthodox church is a diocese,episkopē,10,1,0.125
3737,sikh is a word with its root originated from,"the Sanskrit words शिष्य ( śiṣya ) , meaning a disciple , or a student",10,1,1.0
3738,where is the oldest known rock on earth located,Hudson Bay in northern Quebec,13,1,1.0
3739,who sang the song give me the night,George Benson,31,1,0.5833333333333334
3740,when was the national day of prayer established,1952,21,1,1.0
3741,what is the meaning of half brother or sister,share one parent but not both,24,0,0.0
3742,when do you stop being a minor in canada,19,19,1,0.8183221870721871
3743,when do you stop being a minor in canada,18,19,1,0.6547730047730047
3744,who does the voice of waternoose in monsters inc,James Coburn,8,1,1.0
3745,adventure time how does finn lose his arm,pulled off,26,1,0.5
3746,when did the us first start using drones,1918,56,0,0.0
3747,who is referenced in the song american pie,Ritchie Valens,11,1,1.0
3748,who is referenced in the song american pie,Buddy Holly,18,1,1.0
3749,who is referenced in the song american pie,The Big Bopper,11,1,1.0
3750,number of nfl teams that make the playoffs,12,15,1,0.7974698141364808
3751,who was the french prime minister most responsible for building the absolute monarchy of france,Prime Minister Richelieu,30,1,1.0
3752,who established the republic of china in 1912 ce,Sun Yat - sen,12,1,0.8214646464646462
3753,the interface that connects node b and rnc in umts is,UTRAN ( short for `` Universal Terrestrial Radio Access Network '' ),7,1,1.0
3754,who voiced the pink alien in american dad,Kim Kardashian,16,1,0.09090909090909091
3755,who brought the graeco-macedonian empire to its height,"Alexander III of Macedon ( 20 / 21 July 356 BC -- 10 / 11 June 323 BC ) , commonly known as Alexander the Great",12,0,0.0
3756,metcalfe s law states that the value of a telecommunications network is equal to,proportional to the square of the number of connected users of the system ( n ),16,1,1.0
3757,who sang the eagles song i can't tell you why,Timothy B. Schmit,13,1,1.0
3758,when was last time france was in world cup final,2018,25,1,0.561050061050061
3759,what is the most anyone has won on cash cab,"$6,200",16,1,1.0
3760,how many balls are in a pool table,16,16,1,0.7781114718614719
3761,when did they find sophia in the walking dead,In the mid-season finale `` Pretty Much Dead Already '',18,1,1.0
3762,who made catch me outside how bout that,"Danielle Bregoli ( born March 26 , 2003 ) , also known by her stage name Bhad Bhabie ( pronounced `` bad baby '' )",17,1,0.2
3763,if you are from costa rica what are you called,Costa Ricans,10,1,0.6726551226551226
3764,the hottest recorded temperature on earth occurred where,"Mitribah , Kuwait",12,1,1.0
3765,when does the new mission impossible film come out,"July 27 , 2018",14,1,0.7
3766,who voices rocket in telltale's guardians of the galaxy,Nolan North,7,1,0.5
3767,who won survivor blood vs water san juan del sur,Natalie Anderson,22,1,0.4772727272727273
3768,when did the house pass the american healthcare act,"May 4 , 2017",22,1,0.6805555555555555
3769,which place is known as tea garden of india,Assam,12,1,0.9093537414965984
3770,zen and the art of motorcycle maintenance bikes,"BMW , an R60 / 2",7,1,0.3333333333333333
3771,zen and the art of motorcycle maintenance bikes,CB77 Super Hawk,7,1,0.3333333333333333
3772,where is the reading and leeds festival held,Leeds,9,1,0.984159779614325
3773,where is the reading and leeds festival held,Reading,9,1,0.5333333333333333
3774,when does jackson avery come on the show,season six episode `` Invasion '',10,1,1.0
3775,when did the first starbucks open in the uk,in 1998,23,1,0.625
3776,the actress that plays sue heck on the middle,Eden Rebecca Sher,5,1,0.5
3777,who shot henry in the time traveler's wife,"Clare 's brother ,",8,1,0.5
3778,when was new colossus added to statue of liberty,"1903 ,",9,1,0.6388888888888888
3779,who won the mvp in this year's superbowl,Philadelphia Eagles quarterback Nick Foles,15,1,0.14285714285714285
3780,when did ford start the twin i beam,1965,12,1,0.37777777777777777
3781,write the fate of egg cell and polar nuclei after fertilization,form a diploid zygote,13,1,0.6
3782,who had founded the indian home rule society,Shyamji Krishna Varma,18,1,1.0
3783,who sings the r & b song cupid,112,17,1,0.5
3784,who played the little girl in jersey girl,Raquel Castro,29,0,0.0
3785,who sings crazy in love in 50 shades of grey,Beyoncé,22,1,0.6555555555555554
3786,where was the revenant filmed in the united states,"Canada , the United States , and Argentina",46,1,1.0
3787,who wrote long day's journey into night,Eugene O'Neill,11,1,1.0
3788,who has played susan barlow in coronation street,Joanna Foster,10,1,0.8333333333333333
3789,who has played susan barlow in coronation street,Katie Heannau,10,1,0.8333333333333333
3790,who has played susan barlow in coronation street,Wendy Jane Walker,10,1,1.0
3791,who has played susan barlow in coronation street,Suzy Patterson,19,1,1.0
3792,who sings i wish i was a little bit taller i wish i was a baller,Skee - Lo released under Scotti Bros.,15,1,1.0
3793,us poet known for his light verse crossword,Frederic Ogden Nash,34,0,0.0
3794,who does kanye west voice in south park,Parker,22,1,0.6
3795,does delhi have a unicameral or bicameral legislature,unicameral,15,1,0.984159779614325
3796,who wrote the acts of the apostles in the new testament,anonymous author,15,1,0.41025641025641024
3797,who did the skateboarding in gleaming the cube,Christian Slater,7,1,1.0
3798,buffalo wild wings and weck what does weck mean,beef on weck,13,1,0.8541666666666666
3799,when did harry audition for the x factor,2010,10,1,0.6953308596165739
3800,who played robin on the tv series batman,Burt Ward,19,1,0.5270833333333333
3801,who sang you are a magnet and i am steel,Walter Egan,10,1,1.0
3802,who directed one flew over the cuckoos nest,Miloš Forman,9,1,0.787037037037037
3803,garden inside the taj mahal is known as,charbagh,7,1,0.6922222222222222
3804,who is the author of the fun they had,Isaac Asimov,8,1,1.0
3805,how much is a crown in english money,five pounds,26,0,0.0
3806,what is the queen of spain's name,Letizia Ortiz Rocasolano,9,1,1.0
3807,what state has in god we trust on their license plate,Florida,13,1,0.7366666666666667
3808,where does a thousand splendid suns take place,Kabul in the 20th and 21st century,15,1,1.0
3809,first ufc fighter to hold two belts at the same time,Randall Duane Couture,22,1,0.2
3810,who was forced to give agamemnon's prize,Agamemnon,9,1,0.986013986013986
3811,what is the short story the story of an hour about,"the time elapsed between the moments at which the protagonist , Louise Mallard , hears that her husband is dead , and when she discovers that he is alive after all",25,1,1.0
3812,who won the india's next superstar grand finale,Natasha Bharadwaj,23,1,0.75
3813,who won the india's next superstar grand finale,Aman Gandotra,12,1,0.75
3814,where did the giant rubber duck come from,Dutch,10,1,0.7000000000000001
3815,where did the noble gases get their name,indicate their extremely low level of reactivity,10,1,1.0
3816,who has the most sacks in a season,Michael Strahan,12,1,0.26666666666666666
3817,when did the del mar fair change its name,2002,12,1,0.4888888888888888
3818,who sang the best is yet to come,Tony Bennett,8,1,1.0
3819,who sang the best is yet to come,Frank Sinatra,8,1,1.0
3820,who sang the best is yet to come,Count Basie,12,1,1.0
3821,who played cowboy curtis on pee wee herman,Phil Hartman,7,1,0.7109090909090909
3822,when does chinese new year start this year,16 February,30,1,1.0
3823,who is the first master chef of india,Pankaj Bhadouria,34,1,1.0
3824,where is the patagonia located on a map,"southern end of South America , shared by Argentina and Chile",8,1,1.0
3825,the archway at the entrance of a shinto shrine is known as a,"A torii ( 鳥居 , literally bird abode",7,1,0.3333333333333333
3826,when was the last time georgia had a tropical storm,2004,16,1,0.3463170163170164
3827,when is the european cup final being played,26 May 2018,12,0,0.0
3828,main features of the western approach to conflict resolution,drafting agreements that meet underlying needs,10,1,1.0
3829,main features of the western approach to conflict resolution,fostering communication among disputants,11,1,1.0
3830,main features of the western approach to conflict resolution,problem solving,11,1,0.6666666666666666
3831,where is the great salt plains located in oklahoma,"8 miles ( 13 km ) north of Jet , Oklahoma on SH - 38 and 12 miles ( 19 km ) east of Cherokee",10,1,1.0
3832,who is the band in the movie detroit,"The Dramatics , a professional black R&B group",10,1,0.25
3833,which is the most powerful god in hinduism,the goddess Parvati,9,0,0.0
3834,how many super bowl wins does elway have,three,20,1,1.0
3835,who dies in written in my own heart's blood,Fergus ' son Henri - Christian,13,1,1.0
3836,who does the voice for slinky in toy story,James Albert Varney Jr .,9,1,0.09090909090909091
3837,what is the definition of an inferior good,a good whose demand decreases when consumer income rises ( or demand rises when consumer income decreases ),10,1,1.0
3838,african american winner of oscar tony and emmy,Whoopi Goldberg,15,1,0.5833333333333334
3839,who is the longest serving mp in the uk,Winston Churchill,14,1,0.4409090909090909
3840,what does pure drive mean on nissan qashqai,eco friendly,9,1,1.0
3841,what does a poison tree by william blake mean,"describes the narrator 's repressed feelings of anger towards an individual , emotions which eventually lead to murder",10,1,1.0
3842,who is the newly elected mayor of atlanta,Lance Bottoms,17,1,1.0
3843,who developed the surgical procedure known as a lobotomy,António Egas Moniz,8,1,1.0
3844,when did the 24 valve cummins come out,1998,17,1,0.5909090909090909
3845,curved line connecting 2 more notes different pitches,slur,21,0,0.0
3846,how big is the rudder on an aircraft carrier,29 feet ( 8.8 m ) high and 22 feet ( 6.7 m ) long,7,1,0.5
3847,who is the killer in the movie the collector,an exterminator also working at the Chase house,8,1,0.3333333333333333
3848,when did the wise man's fear come out,"March 1 , 2011",10,1,1.0
3849,who does tri-care provide accident and health coverage to,"U.S Armed Forces military personnel , military retirees , and their dependents , including some members of the Reserve Component",12,0,0.0
3850,when did the atlantic ocean start to open,around 140 million years ago,11,1,0.5
3851,how long does it take for diesel to freeze,17.5 ° F ( − 8.1 ° C ) .,10,0,0.0
3852,which province is called the breadbasket of pakistan,The Punjab province,12,1,0.6984126984126983
3853,what animal has the scientific name phoenicopterus roseus,The greater flamingo,15,1,0.8333333333333333
3854,when did stink bugs come to the us,1998,35,1,0.6984126984126983
3855,when was the first written constitution declared in nepal,1948,25,1,1.0
3856,where did they film much ado about nothing,"Villa Vignamaggio , Greve in Chianti , Florence . Tuscany , Italy",10,1,0.5
3857,who sings the song counting flowers on the wall,The Statler Brothers,9,1,1.0
3858,what is the meaning of verb in english,"a word ( part of speech ) that in syntax conveys an action ( bring , read , walk , run , learn ) , an occurrence ( happen , become ) , or a state of being ( be , exist , stand )",11,1,0.3333333333333333
3859,who was the last person executed in ireland,Michael Manning,14,1,0.2
3860,the role of reciprocal determinism was highlighted by the,Bandura 's Box experiment,7,1,1.0
3861,where is the national multiple sclerosis society located,based in New York City,13,1,1.0
3862,who planted the bomb at the atlanta olympics,Eric Robert Rudolph,9,1,0.625
3863,when were submarines first used in world war 1,5 September 1914,23,0,0.0
3864,how many cities of refuge were the israelites to form,six,11,1,0.6883176347462062
3865,who played ed hall on one life to live,Al Freeman Jr .,40,1,1.0
3866,who wrote rage against the dying of the light,Dylan Thomas,8,0,0.0
3867,when did california community colleges start charging tuition,1978,26,1,0.6904761904761905
3868,when was the second temple built in the bible,516 BCE,22,1,0.8095238095238094
3869,who sang there ain't no cure for the summertime blues,Eddie Cochran,6,1,1.0
3870,what was the purpose of the endangered species act,"to halt and reverse the trend toward species extinction , whatever the cost",8,1,1.0
3871,how many states do we have in the united states of america,50,32,1,0.33958333333333335
3872,what is a remnant according to the bible,What is left of a community after it undergoes a catastrophe,6,1,1.0
3873,how much did dow drop on black monday,508 points,13,1,0.6666666666666666
3874,where was the landmark hotel in las vegas,east of the Las Vegas Strip and across from the Las Vegas Convention Center,10,1,1.0
3875,who bowled the first ball of the world cup 1975,West Indies,19,1,0.9406172110717563
3876,what is the cause of the red reflex,reflection of light from the eye 's retina,6,1,1.0
3877,where are auditory signals processed in the brain,primary auditory cortex,7,1,0.8928571428571428
3878,where was the first home economics conference held,Late in the 19th century,28,1,0.5
3879,where does st. patrick's day originate from,Ireland,14,1,0.897929292929293
3880,show about what if germany won the war,The Man in the High Castle,18,0,0.0
3881,who is the actress that plays mandy on last man standing,Molly Ephraim,19,1,0.625
3882,when did hurricane sandy hit the united states,October 29,31,1,0.8333333333333333
3883,who wrote dublin in the rare old times,Pete St. John,9,1,1.0
3884,when do babies become able to distinguish different speech sounds,as young as 1 month,16,1,0.25
3885,who wrote they long to be close to you,Hal David,9,1,0.8333333333333333
3886,who wrote they long to be close to you,Burt Bacharach,15,1,0.8333333333333333
3887,where is the great north air ambulance based,based in the United Kingdom,10,1,1.0
3888,who played the maid in guess whos coming to dinner,Isabel Sanford,10,1,1.0
3889,when was the last time the ny rangers missed the playoffs,2017 -- 18,30,1,0.5716666666666667
3890,what is the main purpose of mvc architecture,to separate internal representations of information from the ways information is presented to and accepted from the user,23,1,0.5
3891,what type of train is thomas the tank engine,a fictional steam locomotive,14,1,1.0
3892,how many ivy league schools are there in the united states,eight,47,1,0.6614306328592042
3893,name the major types of animals living in the rainforest,invertebrates,14,1,0.5
3894,name the major types of animals living in the rainforest,mammals,11,1,0.7569230769230769
3895,name the major types of animals living in the rainforest,reptiles,22,1,0.7435897435897436
3896,name the major types of animals living in the rainforest,birds,11,1,0.8436979686979686
3897,what is the origin of the name harrison,means `` son of Harry '',10,1,1.0
3898,what is the origin of the name harrison,"in London , England",12,1,1.0
3899,whats the name of the daughter in the addams family,Wednesday Addams,9,1,0.7176190476190477
3900,who is the original singer of mary did you know,Christian recording artist Michael English,16,1,1.0
3901,who played ruth in its a wonderful life,Virginia Ann Patton,10,0,0.0
3902,where did the last name daniel come from,the Book of Daniel,14,1,0.18333333333333335
3903,where did the last name daniel come from,Hebrew origin,18,0,0.0
