,question,answer,query_duration,answer_present,average_precision
5522,fisa is one of the most significant federal terrorism laws. the letters stand for,Foreign Intelligence Surveillance Act,14,1,0.8711111111111111
5523,who has the most strikeouts of all time,Nolan Ryan,10,1,0.8273809523809523
5524,who was the black cabinet member who went on to play an important role in the civil rights movement,Mary Jane McLeod Bethune,22,1,0.3333333333333333
5525,when did the harlem renaissance begin and end,from about 1918 until the mid-1930s,9,1,1.0
5526,india enacted the geographical indications of goods act 1999 in order to comply with,the Agreement on Trade - Related Aspects of Intellectual Property Rights,32,1,0.6
5527,how is magnitude measured using the richter scale,from the logarithm of the amplitude of waves recorded by seismographs,9,1,1.0
5528,what does it mean to be waived in nfl,a team makes an American football player contract or NFL rights ( such as NFL draft rights to an unsigned player ) available to all other teams,9,0,0.0
5529,where was the killers read my mind filmed,Tokyo,10,1,1.0
5530,where does the tri tip steak come from,tensor fasciae latae muscle,10,1,1.0
5531,how much horsepower does a rally car have,380 bhp ( 283.4 kW ),19,1,0.3333333333333333
5532,when did call of duty black ops come out,"November 9 , 2010",13,1,0.7
5533,when did the word lunch start being used,1823,19,1,1.0
5534,when did babe didrikson go to the olympics,1932,10,1,0.5125291375291374
5535,where do the chiefs rugby team come from,"Hamilton , New Zealand",13,1,1.0
5536,who made the swords for lord of the rings,Peter Lyon,16,1,0.1736111111111111
5537,where is area code 608 in united states,much of southwestern Wisconsin,38,1,1.0
5538,where does the kings river start and end,drains an area of the high western Sierra Nevada and the Central Valley,20,1,1.0
5539,where does the kings river start and end,"originate at elevations of above 13,000 feet ( 4,000 m ) along the Sierra crest , in and around Kings Canyon National Park",24,1,1.0
5540,when did the original woody woodpecker come out,1940,17,1,0.75
5541,what is the role of independent election commission in india,to act in an appropriate manner when the enacted laws make insufficient provisions to deal with a given situation in the conduct of an election,20,1,1.0
5542,smps are superior to linear power supplies in respect of,minimizes wasted energy,18,1,1.0
5543,when is a place to call home series 3 back on bbc2,on 25 February 2016,48,1,1.0
5544,which part of canada is closest to detroit,"Windsor , Ontario",30,1,0.7291666666666666
5545,how many oscars did million dollar baby win,four,18,1,0.8598891007981918
5546,what is an example of a double reed instrument,an oboe,16,1,1.0
5547,the 1930s dust bowl in the great plains was caused by,severe drought and a failure to apply dryland farming methods to prevent wind erosion,16,1,1.0
5548,who wrote magical beasts and where to find them,J.K. Rowling ( under the pen name of the fictitious author Newt Scamander ),19,1,1.0
5549,what was the boy's name in night by elie wiesel,Eliezer,15,1,1.0
5550,gibberellins are naturally produced in which part of a plant,the seed embryo,17,1,1.0
5551,beat bobby flay how many times has he won,121,21,1,0.7435897435897436
5552,where did they film the battle of hoth,"The Hardangerjøkulen glacier near Finse , Norway",11,1,1.0
5553,what was the first movie elvis presley made,Love Me Tender,17,1,0.5194805194805194
5554,where are pollen grains produced in a flower,in the microsporangia in the male cone of a conifer or other gymnosperm or in the anthers of an angiosperm flower,11,1,1.0
5555,who became the fifth beatle on let it be playing keyboards on the lp,Billy Preston,29,1,0.6547979797979799
5556,australia's legal system is a common law legal system based on the,decisions of judges,26,0,0.0
5557,when did apple introduce retina display on macbook pro,2012,17,1,0.849066589975681
5558,who is the author of book entitled principles of economics,Alfred Marshall,19,1,0.5238095238095237
5559,when did big air become an olympic sport,2018,21,1,0.7344122544122544
5560,who said all good things must come to an end,Geoffrey Chaucer,31,0,0.0
5561,which canadian city was one of the earliest permanent settlements,St. John 's,16,1,0.5245421245421246
5562,what is the area code of washington dc,202,16,1,0.4296647796647797
5563,when did the half pence go out of circulation,December 1984,12,1,0.25
5564,who is credited with the reinvention and popularization of oil paints,Jan van Eyck,14,1,0.7575757575757575
5565,who sang the song jesus take the wheel,Carrie Underwood,9,1,1.0
5566,what part of the beef is skirt steak,plate,24,1,1.0
5567,who does michael marry in the wedding plan,Shimi,23,1,1.0
5568,who won the shc all-ireland final in 2016,Tipperary,18,1,0.8253968253968254
5569,who was the winner of miss world 2017,Manushi Chhillar of India,37,1,1.0
5570,who won most gold medals in olympics in 2018,both Norway and Germany,12,1,1.0
5571,who wrote the song after the love is gone,Bill Champlin,18,1,1.0
5572,who wrote the song after the love is gone,David Foster,10,1,1.0
5573,who wrote the song after the love is gone,Jay Graydon,14,1,1.0
5574,what is dorothy from wizard of oz last name,Gale,24,1,0.6509084665334666
5575,where are t lymphocytes located in lymph nodes,mainly in the paracortex,7,1,1.0
5576,which branch of philosophy is concerned with fundamental questions about the nature of reality,Metaphysics,36,1,0.9191718775052108
5577,who is the first judge of supreme court in india,Sir HJ Kania,33,1,1.0
5578,who plays the waitress on it's always sunny,Mary Elizabeth Ellis,22,1,0.725
5579,when does you were never really here come out,"limited release in Los Angeles and New York on 6 April 2018 , and a wide release on 20 April",30,1,1.0
5580,the universal time coordinate is also known as,Greenwich Mean Time ( GMT ),13,1,0.5833333333333334
5581,which country is bali an island and province of,Indonesia,13,1,0.7329365079365078
5582,what year did beyonce do the super bowl,2013,29,1,0.578144474573046
5583,the theory of selecting a mate based on nearness is called,Propinquity,17,0,0.0
5584,icarly episode where sam and freddie start dating,`` iLove You '',12,1,1.0
5585,who composed the music and who wrote the words to the opera cosi fan tutti,Lorenzo Da Ponte,11,1,0.4242424242424242
5586,how many tons of gold does the uk have,310.29 metric tonnes,19,0,0.0
5587,what does a ferrite core do on a cable,suppresses high frequency noise,9,1,1.0
5588,where are rubber and palm oil crops usually grown,plantation,9,1,0.737833694083694
5589,who was the old woman in phantom of the opera,Madame Giry,8,1,0.43333333333333335
5590,who won the world cup football in 2002,Brazil,17,1,0.8811979686979688
5591,a question that can be answered with a true or false is considered a,"yes -- no questions ( or polar questions , or general questions )",10,1,0.5
5592,what is a checking account called at a credit union,share draft accounts,18,1,1.0
5593,how many points did wilt chamberlain scored in his nba career,"31,419",19,1,0.5
5594,to increase the depth of field what must you do to magnification,decreasing magnification increases DOF,15,1,1.0
5595,how many season are there of csi miami,10,28,1,0.746024531024531
5596,who was the president during the building of panama canal,Theodore Roosevelt,22,1,0.7435897435897436
5597,when did black and white tv come to australia,30 September 1929,24,1,0.3333333333333333
5598,who plays billy in buffy the vampire slayer,Jeremy Foley,8,0,0.0
5599,who sings why does it have to be wrong or right,American country music group Restless Heart,12,1,1.0
5600,when does the 4th of july holiday start,"July 4 , 1776",11,0,0.0
5601,what kind of music is played in rio carnaval,The samba that is found in Rio is battucanada,11,1,1.0
5602,who started first mid day meal in india,Tamil Nadu,30,1,0.520673076923077
5603,when was the double edged safety razor invented,1901,17,1,1.0
5604,who gets ticket to finale rising star 2018,Hemant Brijwasi,21,1,1.0
5605,who sang everybody's talkin at me in midnight cowboy,Harry Nilsson,15,1,0.9166666666666666
5606,who won the stanley cup finals in 2018,Washington Capitals,15,1,0.63
5607,what is the purpose of realism in literature,to represent familiar things as they are,20,1,0.5
5608,where does the nautical term knots come from,counting the number of knots in the line that unspooled from the reel of a chip log in a specific time,9,1,1.0
5609,most points in a high school basketball career,"135 points , scored by Danny Heater on January 26 , 1960",9,1,0.3333333333333333
5610,who plays taystee on orange is the new black,Danielle Brooks,9,1,0.4131944444444444
5611,who made highest score in one day cricket,Rohit Sharma,37,1,0.2126022126022126
5612,who was the self taught indian mathematical genius in the 20th century,Srinivasa Ramanujan,37,0,0.0
5613,where do you plug in a keyboard or mouse on a pc,The PS / 2 port,15,1,0.25
5614,what type of rna has an amino acid attached and is used in the formation of a peptide chain,tRNA,20,1,0.8371618280709191
5615,who has the second most world series wins,St. Louis Cardinals,29,1,0.7191469024802358
5616,the lateral ligaments of the ankle originate on the,fibula,7,1,0.6028490028490029
5617,what are the chief commercial tree crops of liberia,Timber,17,1,0.8583333333333333
5618,what are the chief commercial tree crops of liberia,natural rubber,9,1,0.625
5619,what are the chief commercial tree crops of liberia,bananas,14,1,0.7777777777777778
5620,what are the chief commercial tree crops of liberia,palm oil,10,1,0.6666666666666667
5621,what season of american idol was adam lambert,eighth,14,1,0.6705738705738704
5622,who gave the framers the idea of separation of powers,"Charles de Secondat , Baron de Montesquieu",10,1,1.0
5623,when did dr phil first appear on oprah,1998,19,1,0.6666666666666666
5624,who played dorcas in lark rise to candleford,Julia Sawalha,7,1,1.0
5625,which acid is used to write on glass,hydrofluoric acid,19,1,0.5654761904761905
5626,where did the conquistadors go to claim land,Asia,9,1,0.5909090909090909
5627,where did the conquistadors go to claim land,Americas,9,1,1.0
5628,where did the conquistadors go to claim land,Oceania,9,1,1.0
5629,where did the conquistadors go to claim land,Africa,21,1,0.6
5630,who sings the song 1 is the loneliest number,Three Dog Night,22,1,0.2
5631,when was oh the places you'll go published,"January 22 , 1990",9,1,1.0
5632,who wrote the book of hebrew in bible,Paul the Apostle,15,1,0.18333333333333335
5633,what is the net yield of atp from glycolysis of one glucose molecule,two net molecules of ATP,11,1,0.3333333333333333
5634,when is you get me coming out on netflix,"June 23 , 2017",11,1,1.0
5635,when was the kashmir issue presented in united nations,1 January 1948,21,1,0.25
5636,when does season 2 of iron fist begin,"September 7 , 2018",26,1,1.0
5637,what is the burning ring of fire song about,falling in love,13,1,1.0
5638,what is the purpose of a grain silo,for bulk storage of grain,6,1,1.0
5639,who is newly elected prime minister of hungry,Viktor Orbán,8,0,0.0
5640,who has the most first round draft picks nfl,Indianapolis Colts,17,1,0.08333333333333333
5641,who opened japan to trade with the treaty of kanagawa,Emperor Kōmei,11,1,0.5769230769230769
5642,how did irene adler tell sherlock the code,Adler reveals that she is still being hunted and asks Sherlock to decipher a code stolen from an MOD official,10,1,0.5
5643,who hit 2 grand slams in the same inning,Fernando Tatís,14,1,0.85
5644,who is the composer of pomp and circumstance,Sir Edward Elgar,6,1,1.0
5645,which emblem served as the symbol for the national recovery administration,the Blue Eagle,12,1,1.0
5646,who plays the first theme in eroica the first time,the cellos,29,0,0.0
5647,who did the voice of aslan in narnia,Liam Neeson,7,1,0.7333333333333333
5648,when did i like it like that come out,1960s,12,1,0.32380952380952377
5649,title iii of the usa patriot act is implemented in part by amendments to which act,Bank Secrecy Act,25,1,0.7071428571428571
5650,title iii of the usa patriot act is implemented in part by amendments to which act,Money Laundering Control Act,17,1,0.7666666666666666
5651,who is the winner in bigg boss season 1 in telugu,Siva Balaji,10,1,1.0
5652,who is the girl locked up in don't breathe,rich young woman,8,1,0.5
5653,who is the girl locked up in don't breathe,Cindy,9,1,0.5
5654,who bagged the miss universe title in may 2000 in camps,Lara Dutta of India,25,1,1.0
5655,who does gossip girl turn out to be,Dan,10,1,1.0
5656,what is the full meaning of napep in nigeria,National Poverty Eradication Programme,18,1,1.0
5657,who opened the first school for the blind in the us,John Dix Fisher,31,1,0.5
5658,name three effects the mariners story has on the wedding guest,bemusement to impatience to fear to fascination,37,1,1.0
5659,when did be more chill the musical come out,2015,11,1,0.6857142857142857
5660,what kind of plane is in american made,a small plane with cameras installed,24,1,1.0
5661,2. describe the conditions for ir absorption to occur,When the frequency of the IR is the same as the vibrational frequency of a bond or collection of bonds,17,0,0.0
5662,when does fall session start in us universities,the day after Labor Day in September,41,0,0.0
5663,which group was considered the backbone of chinese society,wealthy and successful businessmen,13,0,0.0
5664,the grand old duke of york nursery rhyme meaning,futile action,9,1,1.0
5665,what do you get if you win xfactor,a recording contract with record label Syco Music with a stated value of £ 1 million,8,0,0.0
5666,how many players on a nba basketball team,15,10,1,0.7446629759129759
5667,what sector of latin american society led the movement for independence,governing juntas,17,1,0.1111111111111111
5668,who published a book in 1962 that started the environmental movement,Rachel Carson,14,1,0.8773809523809524
5669,where did nate go on ncis los angeles,the Middle East,18,1,0.5
5670,who starred in love is a many splendored thing,Jennifer Jones,9,1,0.5833333333333333
5671,who starred in love is a many splendored thing,William Holden,9,1,0.5833333333333333
5672,who is prime minister of india in 1992,Pamulaparti Venkata Narasimha Rao,12,0,0.0
5673,what is the scientific name for a dingo,( Canis lupus dingo or Canis dingo ),9,1,1.0
5674,who played scott in buffy the vampire slayer,Fabrizio `` Fab '' Filippo,8,0,0.0
5675,when did uk finish paying us for ww2,2006,26,1,0.623335394763966
5676,who is in charge of the super bowl halftime show,The NFL,11,1,0.8254374413465324
5677,when did the university of south carolina integrate,1873,14,1,0.7435897435897436
5678,when does the new series of endevour start,4 February 2018,18,0,0.0
5679,who has won the most uefa euro cups,Spain,9,1,0.8752185314685315
5680,who has won the most uefa euro cups,Germany,9,1,0.7846142746142748
5681,who was the leading lady in raiders of the lost ark,Karen Jane Allen,9,0,0.0
5682,who sings six days on the road i'm going to make it home tonight,Dave Dudley,24,1,1.0
5683,who sings six days on the road i'm going to make it home tonight,Paul Davis,52,1,1.0
5684,who was responsible for the heliocentric theory that stated the earth revolved around the sun,Nicolaus Copernicus,22,1,0.9008736213281667
5685,why was the african country of liberia formed,as a colony for former African American slaves and their free black descendants,21,1,0.5
5686,where was the bridge scene in fast five filmed,a U.S. Navy base pier 60 miles outside San Juan,21,1,1.0
5687,where was the bridge scene in fast five filmed,The Teodoro Moscosco bridge connecting San Juan to neighboring Isla Verde,29,1,1.0
5688,what is the tulsi plant called in english,holy basil,30,1,0.625
5689,what does p&o stand for in p&o cruises,Peninsular and Oriental,21,1,0.8333333333333333
5690,which internet web portal changed its name to altaba inc,Yahoo ! Inc,26,1,1.0
5691,who sang i like driving in my car,Madness,11,1,1.0
5692,in the movie return to sender what did she cut off,his left hand,17,1,1.0
5693,the daughter of a priest and concubine of agamemnon,Chryseis,15,1,0.835
5694,what does milli mean in the metric system,a factor of one thousandth,23,1,0.5
5695,who won women's singles australian open 2018,Caroline Wozniacki,14,1,0.8885281385281385
5696,what kind of food does a bistro serve,"French home - style cooking , and slow - cooked foods",8,1,1.0
5697,the study of the effects of drugs on mind and behavior is called,Pharmacology,11,0,0.0
5698,what impact did the korean war have on u.s. military spending,increased it,21,1,0.5888888888888888
5699,who has scored the most goals in one football match,Archie Thompson,17,1,1.0
5700,who sang tell me why i don't like mondays,The Boomtown Rats,14,1,0.625
5701,avatar the last airbender where is zuko's mother,Forgetful Valley,8,1,0.41666666666666663
5702,who wrote the theme to sanford and son,Quincy Jones,17,1,1.0
5703,what level of courts handle reviews of lower court decisions,appellate court,13,1,0.9121683871683873
5704,when does the second season of greenhouse academy,March 2018,29,1,0.6
5705,hydrosphere covers how much of earth's lithosphere,an area of some 361 million square kilometers ( 139.5 million square miles ),13,1,0.3333333333333333
5706,hydrosphere covers how much of earth's lithosphere,71 %,10,1,0.365079365079365
5707,who has the longest drought of stanley cup,the Toronto Maple Leafs,9,1,0.6215277777777777
5708,when was the last time bristol city were in the premier league,2006 -- 07 season,13,1,0.5932539682539683
5709,what is the length of the british coastline,"11,072.76 miles rounding to 11,073 miles ( 17,820 km )",12,1,0.3333333333333333
5710,extra-chromosomal dna within a bacterial cell is known as,plasmids,8,1,0.6557921245421245
5711,what is child labour age limit in india,"a `` Child '' is defined as any person below the age of 14 , and the CLPR Act prohibits employment of a Child in any employment including as a domestic help",15,1,1.0
5712,who sings with kanye west on ghost town,070 Shake,8,1,1.0
5713,who sings with kanye west on ghost town,PartyNextDoor,8,1,1.0
5714,who sings with kanye west on ghost town,Kid Cudi,8,1,0.5444444444444444
5715,who won the ranji trophy 2018 cricket tournament,Vidarbha,11,1,0.8875
5716,what was built in an effort of cooperation between north and south korea,June 15th North -- South Joint Declaration,24,1,0.2
5717,what was built in an effort of cooperation between north and south korea,Korean Demilitarized Zone,28,1,0.7028138528138529
5718,who was the johnson space center named after,Lyndon B. Johnson Space Center,11,1,0.6916666666666667
5719,what do they say at the beginning of chop suey,We 're rolling ' Suicide ',25,1,1.0
5720,how do you become a member of the augusta national golf club,by invitation,26,1,1.0
5721,on what island was the movie castaway filmed,Modriki Island,17,0,0.0
5722,who were the paralympic games initially meant for,athletes in wheelchairs,20,1,1.0
5723,who does the winner of the alcs play,winner of the National League ( NL ),8,1,1.0
5724,who was the famous indo greek king who embraced buddhism,Menander I Soter,20,1,0.2
5725,which is the major limiting element in marine primary production,mineral nutrients,13,1,1.0
5726,which is the major limiting element in marine primary production,the availability of light,32,1,1.0
5727,where do most monkeys live in the world,South and Middle America,34,0,0.0
5728,where do most monkeys live in the world,Africa,19,1,0.7133333333333334
5729,where do most monkeys live in the world,Southeast Asia,21,1,0.17424242424242425
5730,who made the first radio broadcast in the world,On Christmas Eve 1906,24,1,0.1111111111111111
5731,how many episodes of this is us in season two,18,30,1,0.7113867613867614
5732,when does the rainy season start in oregon,November,14,1,0.8784677443768353
5733,what is the altitude of yosemite national park,"from 2,127 to 13,114 feet ( 648 to 3,997 m )",17,1,1.0
5734,what is the role of a sergeant at arms,"appointed by a deliberative body , usually a legislature , to keep order during its meetings",14,1,0.2
5735,what is the tallest building in buffalo ny,the One Seneca Center,11,1,1.0
5736,how many stock exchanges are there in china,two,12,1,0.902962693871785
5737,a system of linear equations is consistent if,"if there is at least one set of values for the unknowns that satisfies every equation in the system -- that is , that when substituted into each of the equations makes each equation hold true as an identity",7,1,0.5
5738,what types of organizations were involved in developing the tia/eia-568-b standard,consultants,14,1,1.0
5739,what types of organizations were involved in developing the tia/eia-568-b standard,manufacturers,14,1,0.6185897435897436
5740,what types of organizations were involved in developing the tia/eia-568-b standard,end - users,15,1,1.0
5741,where is a view to a kill filmed,United States,11,1,0.6977777777777778
5742,where is a view to a kill filmed,London,11,1,0.7453968253968255
5743,where is a view to a kill filmed,Iceland,29,1,1.0
5744,where is a view to a kill filmed,Switzerland,20,1,1.0
5745,where is a view to a kill filmed,France,9,1,0.4983164983164983
5746,who composed the lord of the rings music,Howard Leslie Shore,19,0,0.0
5747,where was the technology that has become google maps first developed,Sydney - based company Where 2 Technologies,15,1,1.0
5748,where did the term mosh pit come from,"California and Washington , D.C.",24,1,1.0
5749,when does i stand here ironing take place,the early 1950s,23,1,1.0
5750,how to call emergency services from a mobile phone uk,999,20,1,0.7933333333333333
5751,who made the first telescope and used it to observe the sky,Hans Lippershey,19,1,0.4666666666666666
5752,where is jack link's beef jerky made,"Bellevue , Nebraska",7,1,1.0
5753,where is jack link's beef jerky made,"Minong , Wisconsin",16,1,1.0
5754,where is jack link's beef jerky made,"New Glarus , Wisconsin",11,1,1.0
5755,where is jack link's beef jerky made,"Alpena , South Dakota",7,1,1.0
5756,where is jack link's beef jerky made,"Mankato , Minnesota",22,1,1.0
5757,where is jack link's beef jerky made,"Laurens , Iowa",10,1,1.0
5758,who was the leader of the soviet union when sputnik was launched,Soviet premier Nikita Khrushchev,15,1,0.3686868686868686
5759,who scored the first points in nba history,Oscar Benjamin `` Ossie '' Schectman,14,0,0.0
5760,when was red bull released in the us,1997,19,1,0.7048611111111112
5761,what did paper clips represent during the holocaust,a silent protest against Nazi occupation,10,1,1.0
5762,who plays emma frost in x-men first class,January Jones,33,1,0.5833333333333334
5763,what is the population of santa fe texas,"12,222",8,1,1.0
5764,who wrote the music to the lion king,Hans Zimmer,10,1,0.7321428571428571
5765,who played freddy krueger on nightmare on elm street,Robert Barton Englund,13,0,0.0
5766,who sang you're a mean one mr. grinch in the iconic 1966 animated tv show,Thurl Ravenscroft,24,1,0.81
5767,addition of bismuth chloride to excess of water produces,"the intermediate monohydrate , BiCl. H O",8,1,1.0
5768,who plays dr. riggs on grey's anatomy,Martin Henderson,16,1,0.6379268879268878
5769,who gave britain the right to rule palestine,the League of Nations,26,1,0.8766233766233766
5770,nfl what does it mean to clear waivers,"becomes a free agent is free to negotiate and sign a contract with any NFL club , and any NFL club is free to negotiate and sign a contract with such player",15,1,1.0
5771,what is the function of a saggital crest in mammals,"primarily for attachment of the temporalis muscle , which is one of the main chewing muscles",7,1,1.0
5772,who thought atoms and the void comprised all of reality,Parmenides of Elea,11,1,0.2
5773,where was the bill of rights written and signed,"in Philadelphia , Pennsylvania",17,1,0.3333333333333333
5774,who's the oldest person living right now,Nabi Tajima,21,1,0.7
5775,where does the name bobby pin come from,to hold the new bobbed hairstyles,10,1,1.0
5776,who sang this old house in the 1950s,Rosemary Clooney,15,1,0.6984126984126983
5777,how many times the word ilm come in the holy quran,704,10,1,0.3333333333333333
5778,tv show where cop goes back in time,Life on Mars,10,0,0.0
5779,the cultural blending of greek and roman culture came to be called,Greco - Roman culture,24,0,0.0
5780,where does the urethra exit from the female body,urinary meatus above the vaginal opening,16,1,1.0
5781,what type of bonds are found in a molecule of octane,hydrocarbon,10,1,0.5166666666666666
5782,who sings you are the magnet and i am the steel,Walter Egan,15,1,1.0
5783,who played nala in the lion king movie,Sally Dworsky,12,1,0.75
5784,who played nala in the lion king movie,Moira Kelly,16,1,0.7476190476190476
5785,who played nala in the lion king movie,Niketa Calame,10,1,0.75
5786,who played nala in the lion king movie,Laura Williams,21,1,0.75
5787,when is a control system said to be robust,if it also works well under a different set of assumptions,20,1,1.0
5788,who are the actresses that played in thelma and louise,Susan Sarandon,8,1,0.6666666666666665
5789,who are the actresses that played in thelma and louise,Geena Davis,22,1,0.8333333333333333
5790,lowest female literacy rate state in india 2011,Rajasthan,14,1,0.7574786324786325
5791,where are lymph nodes concentrated in the body,near and within the trunk,20,1,1.0
5792,why did the united states support the french war effort in vietnam,the Cold War Mutual Defense Programme,50,0,0.0
5793,i love lucy episode where she has the baby,`` Lucy Goes to the Hospital '',14,1,0.375
5794,total number of states in india in 1947,564,17,1,0.14285714285714285
5795,where is the bar in it's always sunny in philadelphia,South Philadelphia,18,1,0.4772727272727273
5796,who was the captain of the flying dutchman,Davy Jones,12,1,0.8599888537388536
5797,who has the highest h index in medicine,Solomon H. Snyder,13,1,1.0
